<?xml version="1.0" encoding="UTF-8"?>
<xs:schema xmlns:xs="http://www.w3.org/2001/XMLSchema">
    <xs:element name="countries">
        <xs:complexType>
            <xs:sequence>
                <xs:element name="country" maxOccurs="unbounded">
                    <xs:complexType>
                        <xs:sequence>
                            <xs:element name="alpha2">
                                <xs:simpleType>
                                    <xs:restriction base="xs:string">
                                        <xs:pattern value="[A-Z]{2}"/>
                                    </xs:restriction>
                                </xs:simpleType>
                            </xs:element>
                            <xs:element name="alpha3">
                                <xs:simpleType>
                                    <xs:restriction base="xs:string">
                                        <xs:pattern value="[A-Z]{3}"/>
                                    </xs:restriction>
                                </xs:simpleType>
                            </xs:element>
                            <xs:element name="name" type="xs:string"/>
                            <xs:element name="capital" type="xs:string"/>
                            <xs:element name="region" type="xs:string"/>
                            <xs:element name="subregion" type="xs:string"/>
                            <xs:element name="currency">
                                <xs:simpleType>
                                    <xs:restriction base="xs:string">
                                        <xs:pattern value="[A-Z]{3}"/>
                                    </xs:restriction>
                                </xs:simpleType>
                            </xs:element>
                            <xs:element name="currencyName" type="xs:string"/>
                            <xs:element name="language" type="xs:string"/>
                        </xs:sequence>
                        <xs:attribute name="id" type="xs:ID" use="required"/>
                    </xs:complexType>
                </xs:element>
            </xs:sequence>
        </xs:complexType>
    </xs:element>
</xs:schema>
